{
  "kind": "amend",
  "summary": "汇总维度改为月份 × 地区，并新增按地区的柱状图。",
  "stop": [
    "只按月汇总的输出格式"
  ],
  "keep": [
    "已完成的清洗结果（去重、日期统一）"
  ],
  "add": [
    "summary.csv 改为 month,region,total_sales 三列",
    "生成按地区汇总的柱状图 /work/out/sales_by_region.png"
  ],
  "acceptance_changes": [
    {
      "op": "modify",
      "criterion_id": "ac1",
      "text": "/work/out/summary.csv 存在，列为 month,region,total_sales"
    },
    {
      "op": "add",
      "text": "/work/out/sales_by_region.png 存在，是按地区汇总的柱状图",
      "criterion_id": "ac6"
    }
  ],
  "constraints_verbatim": [
    "统一日期格式为 YYYY-MM-DD",
    "不要修改原始文件",
    "金额保留两位小数",
    "汇总改成按月和地区两个维度",
    "加一张按地区的柱状图 PNG"
  ],
  "request_id": "req_01JBC7Q5W8M2N3P4R5S6T7V8X9",
  "task_id": "tsk_01JBC7Q5W8M2N3P4R5S6T7V8X9",
  "change_id": "chg_01JBC7R2A3B4C5D6E7F8G9H0JK",
  "from_role": "dispatcher",
  "based_on_requirements_revision": 2,
  "target_task_revision": 2,
  "target_plan_revision": 2,
  "dispatcher_epoch": 1,
  "constraint_refs": [
    "c1",
    "c2",
    "c3",
    "c4",
    "c5"
  ]
}
